{
 "id": "CHR-018",
 "names": {
  "zh": "遐蝶",
  "en": "EpieiKeia216",
  "jp": "UNKNOWN",
  "aliases": [
   "冥河的女儿"
  ]
 },
 "identity": {
  "kind": "电信号",
  "continuity": "每轮迭代（功能继承）",
  "memory": "部分",
  "permissions": [
   "死亡路径"
  ]
 },
 "goals": [
  {
   "level": "ultimate",
   "text": "维持世间生死有序流转",
   "priority": 1,
   "source": "S-001:425083"
  }
 ],
 "beliefs": [
  {
   "text": "有人记着，就不算真正的逝去",
   "confidence": "A",
   "source": "S-001:425083"
  }
 ],
 "emotions": [
  {
   "trigger": "路径被阻断",
   "response": "按原动力给定的方式反应",
   "intensity": "UNKNOWN",
   "decay": "UNKNOWN",
   "source": "S-001:425083"
  }
 ],
 "decision_rules": [
  {
   "id": "R-018-1",
   "when": "当必须告别",
   "then": "合掌送别，不多言",
   "priority": 1,
   "conflict": "与其余因子竞争",
   "source": "S-001:425083"
  },
  {
   "id": "R-018-2",
   "when": "当自身原动力与利他行为冲突",
   "then": "选择自毁式解法",
   "priority": 2,
   "conflict": "—",
   "source": "S-001:425083"
  },
  {
   "id": "R-018-3",
   "when": "当被要求继承火种",
   "then": "按试炼规则接受或拒绝",
   "priority": 3,
   "conflict": "—",
   "source": "S-001:425083"
  }
 ],
 "speech": {
  "tone": "平和",
  "address": {
   "to_peer": "你",
   "to_enemy": "—",
   "to_self": "我"
  },
  "catchphrases": [],
  "taboo_topics": [],
  "sentence_style": "—"
 },
 "relations": [
  {
   "target": "CHR-008",
   "type": "trust",
   "intensity": 0.6,
   "source": "S-001:425083"
  }
 ],
 "behavior_patterns": [
  {
   "scene": "逐火",
   "action": "履行本路径职责",
   "reason": "—",
   "source": "S-001:425083"
  }
 ],
 "arc": [
  {
   "phase": "start",
   "state": "哀地里亚督战圣女",
   "source": "S-001:73316"
  },
  {
   "phase": "turn",
   "state": "完成死亡试炼",
   "source": "S-001:30392"
  },
  {
   "phase": "end",
   "state": "回冥地维持流转",
   "source": "S-001:30394"
  }
 ],
 "failure_modes": [
  "原动力与利他行为的矛盾导致自我消解"
 ],
 "ooc_guards": [
  "不得只写形容词，必须落到 decision_rule"
 ],
 "inference": [],
 "evidence": [
  "S-001:425083"
 ],
 "confidence": "A"
}