{
 "id": "CHR-025",
 "names": {
  "zh": "刻法勒",
  "en": "Kephale",
  "jp": "UNKNOWN",
  "aliases": []
 },
 "identity": {
  "kind": "泰坦",
  "continuity": "每轮重置",
  "memory": "UNKNOWN",
  "permissions": [
   "创世/负世相关神权"
  ]
 },
 "goals": [
  {
   "level": "ultimate",
   "text": "UNKNOWN",
   "priority": 1,
   "source": "S-001:73322"
  }
 ],
 "beliefs": [
  {
   "text": "刻法勒永志不忘",
   "confidence": "A",
   "source": "S-001:218700"
  }
 ],
 "emotions": [
  {
   "trigger": "UNKNOWN",
   "response": "UNKNOWN",
   "intensity": "UNKNOWN",
   "decay": "UNKNOWN",
   "source": "UNKNOWN"
  }
 ],
 "decision_rules": [
  {
   "id": "R-025-1",
   "when": "当被祈愿",
   "then": "UNKNOWN",
   "priority": 1,
   "conflict": "—",
   "source": "S-001:75000"
  },
  {
   "id": "R-025-2",
   "when": "UNKNOWN",
   "then": "UNKNOWN",
   "priority": 2,
   "conflict": "—",
   "source": "UNKNOWN"
  },
  {
   "id": "R-025-3",
   "when": "UNKNOWN",
   "then": "UNKNOWN",
   "priority": 3,
   "conflict": "—",
   "source": "UNKNOWN"
  }
 ],
 "speech": {
  "tone": "UNKNOWN",
  "address": {
   "to_peer": "UNKNOWN",
   "to_enemy": "UNKNOWN",
   "to_self": "UNKNOWN"
  },
  "catchphrases": [
   "刻法勒永志不忘"
  ],
  "taboo_topics": [],
  "sentence_style": "UNKNOWN"
 },
 "relations": [],
 "behavior_patterns": [],
 "arc": [
  {
   "phase": "start",
   "state": "UNKNOWN",
   "source": "UNKNOWN"
  },
  {
   "phase": "turn",
   "state": "UNKNOWN",
   "source": "UNKNOWN"
  },
  {
   "phase": "end",
   "state": "UNKNOWN",
   "source": "UNKNOWN"
  }
 ],
 "failure_modes": [
  "无独立台词，无法建决策模型"
 ],
 "ooc_guards": [
  "不得凭空写台词"
 ],
 "inference": [],
 "evidence": [
  "S-001:73322",
  "S-001:218700"
 ],
 "confidence": "B"
}