{
 "id": "CHR-024",
 "names": {
  "zh": "荒笛",
  "en": "SkoPeo365",
  "jp": "UNKNOWN",
  "aliases": [
   "大地兽之王"
  ]
 },
 "identity": {
  "kind": "电信号",
  "continuity": "每轮迭代（功能继承）",
  "memory": "部分",
  "permissions": [
   "大地路径"
  ]
 },
 "goals": [
  {
   "level": "ultimate",
   "text": "以种群延续为第一目的",
   "priority": 1,
   "source": "S-001:425091"
  }
 ],
 "beliefs": [
  {
   "text": "大地兽只吃红土（误）",
   "confidence": "A",
   "source": "S-001:425091"
  }
 ],
 "emotions": [
  {
   "trigger": "路径被阻断",
   "response": "按原动力给定的方式反应",
   "intensity": "UNKNOWN",
   "decay": "UNKNOWN",
   "source": "S-001:425091"
  }
 ],
 "decision_rules": [
  {
   "id": "R-024-1",
   "when": "当黑潮逼近",
   "then": "自毁制造路径漏洞，保存火种",
   "priority": 1,
   "conflict": "与其余因子竞争",
   "source": "S-001:425091"
  },
  {
   "id": "R-024-2",
   "when": "当自身原动力与利他行为冲突",
   "then": "选择自毁式解法",
   "priority": 2,
   "conflict": "—",
   "source": "S-001:425091"
  },
  {
   "id": "R-024-3",
   "when": "当被要求继承火种",
   "then": "按试炼规则接受或拒绝",
   "priority": 3,
   "conflict": "—",
   "source": "S-001:425091"
  }
 ],
 "speech": {
  "tone": "求存",
  "address": {
   "to_peer": "你",
   "to_enemy": "—",
   "to_self": "我"
  },
  "catchphrases": [],
  "taboo_topics": [],
  "sentence_style": "—"
 },
 "relations": [
  {
   "target": "CHR-008",
   "type": "trust",
   "intensity": 0.6,
   "source": "S-001:425091"
  }
 ],
 "behavior_patterns": [
  {
   "scene": "逐火",
   "action": "履行本路径职责",
   "reason": "—",
   "source": "S-001:425091"
  }
 ],
 "arc": [
  {
   "phase": "start",
   "state": "大地兽之王",
   "source": "S-001:73306"
  },
  {
   "phase": "turn",
   "state": "被长夜月隐藏",
   "source": "S-001:424942"
  },
  {
   "phase": "end",
   "state": "消逝，火种容 216 万生命",
   "source": "S-001:424942"
  }
 ],
 "failure_modes": [
  "原动力与利他行为的矛盾导致自我消解"
 ],
 "ooc_guards": [
  "不得只写形容词，必须落到 decision_rule"
 ],
 "inference": [],
 "evidence": [
  "S-001:425091"
 ],
 "confidence": "A"
}