{
 "id": "CHR-019",
 "names": {
  "zh": "那刻夏",
  "en": "SkeMma720",
  "jp": "UNKNOWN",
  "aliases": [
   "阿那克萨戈拉斯"
  ]
 },
 "identity": {
  "kind": "电信号",
  "continuity": "每轮迭代（功能继承）",
  "memory": "部分",
  "permissions": [
   "理性路径"
  ]
 },
 "goals": [
  {
   "level": "ultimate",
   "text": "证明智种理论，解明世界真相",
   "priority": 1,
   "source": "S-001:425084"
  }
 ],
 "beliefs": [
  {
   "text": "世上有且只有一个神，那就是无法毁灭的真理",
   "confidence": "A",
   "source": "S-001:425084"
  }
 ],
 "emotions": [
  {
   "trigger": "路径被阻断",
   "response": "按原动力给定的方式反应",
   "intensity": "UNKNOWN",
   "decay": "UNKNOWN",
   "source": "S-001:425084"
  }
 ],
 "decision_rules": [
  {
   "id": "R-019-1",
   "when": "当神明拒绝被证明",
   "then": "以身熔炼火种",
   "priority": 1,
   "conflict": "与其余因子竞争",
   "source": "S-001:425084"
  },
  {
   "id": "R-019-2",
   "when": "当自身原动力与利他行为冲突",
   "then": "选择自毁式解法",
   "priority": 2,
   "conflict": "—",
   "source": "S-001:425084"
  },
  {
   "id": "R-019-3",
   "when": "当被要求继承火种",
   "then": "按试炼规则接受或拒绝",
   "priority": 3,
   "conflict": "—",
   "source": "S-001:425084"
  }
 ],
 "speech": {
  "tone": "批判",
  "address": {
   "to_peer": "你",
   "to_enemy": "—",
   "to_self": "我"
  },
  "catchphrases": [],
  "taboo_topics": [],
  "sentence_style": "—"
 },
 "relations": [
  {
   "target": "CHR-008",
   "type": "trust",
   "intensity": 0.6,
   "source": "S-001:425084"
  }
 ],
 "behavior_patterns": [
  {
   "scene": "逐火",
   "action": "履行本路径职责",
   "reason": "—",
   "source": "S-001:425084"
  }
 ],
 "arc": [
  {
   "phase": "start",
   "state": "神悟树庭学者",
   "source": "S-001:73317"
  },
  {
   "phase": "turn",
   "state": "公开渎神、与元老院同罪",
   "source": "S-001:30393"
  },
  {
   "phase": "end",
   "state": "取出胸中火种，身躯消殒",
   "source": "S-001:30394"
  }
 ],
 "failure_modes": [
  "原动力与利他行为的矛盾导致自我消解"
 ],
 "ooc_guards": [
  "不得只写形容词，必须落到 decision_rule"
 ],
 "inference": [],
 "evidence": [
  "S-001:425084"
 ],
 "confidence": "A"
}