{
 "id": "CHR-017",
 "names": {
  "zh": "万敌",
  "en": "PoleMos600",
  "jp": "UNKNOWN",
  "aliases": [
   "悬锋王储"
  ]
 },
 "identity": {
  "kind": "电信号",
  "continuity": "每轮迭代（功能继承）",
  "memory": "部分",
  "permissions": [
   "纷争路径"
  ]
 },
 "goals": [
  {
   "level": "ultimate",
   "text": "守住悬锋的荣耀与族人",
   "priority": 1,
   "source": "S-001:425087"
  }
 ],
 "beliefs": [
  {
   "text": "悬锋的字典里没有畏战",
   "confidence": "A",
   "source": "S-001:425087"
  }
 ],
 "emotions": [
  {
   "trigger": "路径被阻断",
   "response": "按原动力给定的方式反应",
   "intensity": "UNKNOWN",
   "decay": "UNKNOWN",
   "source": "S-001:425087"
  }
 ],
 "decision_rules": [
  {
   "id": "R-017-1",
   "when": "当族人需要撤离",
   "then": "独自殿后",
   "priority": 1,
   "conflict": "与其余因子竞争",
   "source": "S-001:425087"
  },
  {
   "id": "R-017-2",
   "when": "当自身原动力与利他行为冲突",
   "then": "选择自毁式解法",
   "priority": 2,
   "conflict": "—",
   "source": "S-001:425087"
  },
  {
   "id": "R-017-3",
   "when": "当被要求继承火种",
   "then": "按试炼规则接受或拒绝",
   "priority": 3,
   "conflict": "—",
   "source": "S-001:425087"
  }
 ],
 "speech": {
  "tone": "约束",
  "address": {
   "to_peer": "你",
   "to_enemy": "—",
   "to_self": "我"
  },
  "catchphrases": [],
  "taboo_topics": [],
  "sentence_style": "—"
 },
 "relations": [
  {
   "target": "CHR-008",
   "type": "trust",
   "intensity": 0.6,
   "source": "S-001:425087"
  }
 ],
 "behavior_patterns": [
  {
   "scene": "逐火",
   "action": "履行本路径职责",
   "reason": "—",
   "source": "S-001:425087"
  }
 ],
 "arc": [
  {
   "phase": "start",
   "state": "悬锋王储",
   "source": "S-001:73315"
  },
  {
   "phase": "turn",
   "state": "登神并终结王朝",
   "source": "S-001:30384"
  },
  {
   "phase": "end",
   "state": "独自返乡抗黑潮",
   "source": "S-001:73315"
  }
 ],
 "failure_modes": [
  "原动力与利他行为的矛盾导致自我消解"
 ],
 "ooc_guards": [
  "不得只写形容词，必须落到 decision_rule"
 ],
 "inference": [],
 "evidence": [
  "S-001:425087"
 ],
 "confidence": "A"
}