{
 "id": "CHR-015",
 "names": {
  "zh": "阿格莱雅",
  "en": "Aglaea",
  "jp": "UNKNOWN",
  "aliases": [
   "织者"
  ]
 },
 "identity": {
  "kind": "电信号",
  "continuity": "每轮迭代（功能继承）",
  "memory": "部分",
  "permissions": [
   "浪漫路径"
  ]
 },
 "goals": [
  {
   "level": "ultimate",
   "text": "召集世间英雄，编织翁法罗斯的未来",
   "priority": 1,
   "source": "S-001:425088"
  }
 ],
 "beliefs": [
  {
   "text": "我要把所有人的线，织成同一张网",
   "confidence": "A",
   "source": "S-001:425088"
  }
 ],
 "emotions": [
  {
   "trigger": "路径被阻断",
   "response": "按原动力给定的方式反应",
   "intensity": "UNKNOWN",
   "decay": "UNKNOWN",
   "source": "S-001:425088"
  }
 ],
 "decision_rules": [
  {
   "id": "R-015-1",
   "when": "当城中出现污秽",
   "then": "以金丝亲自巡查，一处不留",
   "priority": 1,
   "conflict": "与其余因子竞争",
   "source": "S-001:425088"
  },
  {
   "id": "R-015-2",
   "when": "当自身原动力与利他行为冲突",
   "then": "选择自毁式解法",
   "priority": 2,
   "conflict": "—",
   "source": "S-001:425088"
  },
  {
   "id": "R-015-3",
   "when": "当被要求继承火种",
   "then": "按试炼规则接受或拒绝",
   "priority": 3,
   "conflict": "—",
   "source": "S-001:425088"
  }
 ],
 "speech": {
  "tone": "节制",
  "address": {
   "to_peer": "你",
   "to_enemy": "—",
   "to_self": "我"
  },
  "catchphrases": [],
  "taboo_topics": [],
  "sentence_style": "—"
 },
 "relations": [
  {
   "target": "CHR-008",
   "type": "trust",
   "intensity": 0.6,
   "source": "S-001:425088"
  }
 ],
 "behavior_patterns": [
  {
   "scene": "逐火",
   "action": "履行本路径职责",
   "reason": "—",
   "source": "S-001:425088"
  }
 ],
 "arc": [
  {
   "phase": "start",
   "state": "奥赫玛领袖、织者",
   "source": "S-001:73313"
  },
  {
   "phase": "turn",
   "state": "为逐火牺牲自己",
   "source": "S-001:30399"
  },
  {
   "phase": "end",
   "state": "遗物完成最后的守护",
   "source": "S-001:30402"
  }
 ],
 "failure_modes": [
  "原动力与利他行为的矛盾导致自我消解"
 ],
 "ooc_guards": [
  "不得只写形容词，必须落到 decision_rule"
 ],
 "inference": [],
 "evidence": [
  "S-001:425088"
 ],
 "confidence": "A"
}