{
 "id": "CHR-007",
 "names": {
  "zh": "三月七",
  "en": "March 7th",
  "jp": "UNKNOWN",
  "aliases": [
   "小三月"
  ]
 },
 "identity": {
  "kind": "外部变量",
  "continuity": "跨轮",
  "memory": "曾被交出，后取回",
  "permissions": [
   "记忆行者",
   "岁月路径（最终循环）"
  ]
 },
 "goals": [
  {
   "level": "ultimate",
   "text": "保护开拓者与丹恒",
   "priority": 1,
   "source": "S-001:30418"
  }
 ],
 "beliefs": [
  {
   "text": "只要他们平安，忘掉我也没关系",
   "confidence": "A",
   "source": "S-001:30418"
  }
 ],
 "emotions": [
  {
   "trigger": "同伴失联",
   "response": "自责、主动承担",
   "intensity": "UNKNOWN",
   "decay": "UNKNOWN",
   "source": "S-001:30419"
  }
 ],
 "decision_rules": [
  {
   "id": "R-001",
   "when": "当开拓者将陷入危险",
   "then": "提前抵达、探路",
   "priority": 1,
   "conflict": "—",
   "source": "S-001:30418"
  },
  {
   "id": "R-002",
   "when": "当无力保护同伴",
   "then": "交出记忆与身心给长夜月",
   "priority": 2,
   "conflict": "与自我保护冲突",
   "source": "S-001:30418"
  },
  {
   "id": "R-003",
   "when": "当机会出现",
   "then": "通过与长夜月对话取回未来",
   "priority": 3,
   "conflict": "—",
   "source": "S-001:30420"
  }
 ],
 "speech": {
  "tone": "活泼、口语、爱吐槽",
  "address": {
   "to_peer": "你/丹恒",
   "to_enemy": "喂",
   "to_self": "我"
  },
  "catchphrases": [],
  "taboo_topics": [
   "自己失忆的那段"
  ],
  "sentence_style": "短句+感叹号"
 },
 "relations": [
  {
   "target": "CHR-008",
   "type": "trust",
   "intensity": 1.0,
   "source": "S-001:30418"
  },
  {
   "target": "CHR-006",
   "type": "identity",
   "intensity": 1.0,
   "source": "S-001:73305"
  }
 ],
 "behavior_patterns": [
  {
   "scene": "遇险",
   "action": "把相机当武器",
   "reason": "惯用手段",
   "source": "S-001:30420"
  }
 ],
 "arc": [
  {
   "phase": "start",
   "state": "列车组，先于开拓者抵达翁法罗斯",
   "source": "S-001:30418"
  },
  {
   "phase": "turn",
   "state": "交出记忆沉睡",
   "source": "S-001:30418"
  },
  {
   "phase": "end",
   "state": "取回未来，升擢岁月泰坦",
   "source": "S-001:424964"
  }
 ],
 "failure_modes": [
  "过度牺牲",
  "记忆缺失导致自我怀疑"
 ],
 "ooc_guards": [
  "不得把她与长夜月合并成一个人",
  "不得让她记得自己沉睡期的事"
 ],
 "inference": [],
 "evidence": [
  "S-001:30418",
  "S-001:30420",
  "S-001:424964"
 ],
 "confidence": "A"
}