{
 "id": "CHR-021",
 "names": {
  "zh": "赛飞儿",
  "en": "OreXis945",
  "jp": "UNKNOWN",
  "aliases": [
   "赛法利娅"
  ]
 },
 "identity": {
  "kind": "电信号",
  "continuity": "每轮迭代（功能继承）",
  "memory": "部分",
  "permissions": [
   "诡计路径"
  ]
 },
 "goals": [
  {
   "level": "ultimate",
   "text": "以谎言维系奥赫玛的千年光明",
   "priority": 1,
   "source": "S-001:425082"
  }
 ],
 "beliefs": [
  {
   "text": "就当帮我一次，骗骗死亡那又如何",
   "confidence": "A",
   "source": "S-001:425082"
  }
 ],
 "emotions": [
  {
   "trigger": "路径被阻断",
   "response": "按原动力给定的方式反应",
   "intensity": "UNKNOWN",
   "decay": "UNKNOWN",
   "source": "S-001:425082"
  }
 ],
 "decision_rules": [
  {
   "id": "R-021-1",
   "when": "当火种将被夺",
   "then": "用计把火种藏走，自己留下",
   "priority": 1,
   "conflict": "与其余因子竞争",
   "source": "S-001:425082"
  },
  {
   "id": "R-021-2",
   "when": "当自身原动力与利他行为冲突",
   "then": "选择自毁式解法",
   "priority": 2,
   "conflict": "—",
   "source": "S-001:425082"
  },
  {
   "id": "R-021-3",
   "when": "当被要求继承火种",
   "then": "按试炼规则接受或拒绝",
   "priority": 3,
   "conflict": "—",
   "source": "S-001:425082"
  }
 ],
 "speech": {
  "tone": "渴望",
  "address": {
   "to_peer": "你",
   "to_enemy": "—",
   "to_self": "我"
  },
  "catchphrases": [],
  "taboo_topics": [],
  "sentence_style": "—"
 },
 "relations": [
  {
   "target": "CHR-008",
   "type": "trust",
   "intensity": 0.6,
   "source": "S-001:425082"
  }
 ],
 "behavior_patterns": [
  {
   "scene": "逐火",
   "action": "履行本路径职责",
   "reason": "—",
   "source": "S-001:425082"
  }
 ],
 "arc": [
  {
   "phase": "start",
   "state": "多洛斯盗贼",
   "source": "S-001:73319"
  },
  {
   "phase": "turn",
   "state": "骗局被识破",
   "source": "S-001:30398"
  },
  {
   "phase": "end",
   "state": "被盗火行者刺穿",
   "source": "S-001:30403"
  }
 ],
 "failure_modes": [
  "原动力与利他行为的矛盾导致自我消解"
 ],
 "ooc_guards": [
  "不得只写形容词，必须落到 decision_rule"
 ],
 "inference": [],
 "evidence": [
  "S-001:425082"
 ],
 "confidence": "A"
}