{
 "id": "CHR-023",
 "names": {
  "zh": "刻律德菈",
  "en": "HubRis504",
  "jp": "UNKNOWN",
  "aliases": [
   "凯撒"
  ]
 },
 "identity": {
  "kind": "电信号",
  "continuity": "每轮迭代（功能继承）",
  "memory": "部分",
  "permissions": [
   "律法路径"
  ]
 },
 "goals": [
  {
   "level": "ultimate",
   "text": "让翁法罗斯自立于群星",
   "priority": 1,
   "source": "S-001:425085"
  }
 ],
 "beliefs": [
  {
   "text": "我已至，我已见，我已征服",
   "confidence": "A",
   "source": "S-001:425085"
  }
 ],
 "emotions": [
  {
   "trigger": "路径被阻断",
   "response": "按原动力给定的方式反应",
   "intensity": "UNKNOWN",
   "decay": "UNKNOWN",
   "source": "S-001:425085"
  }
 ],
 "decision_rules": [
  {
   "id": "R-023-1",
   "when": "当规则阻碍目标",
   "then": "改写规则本身",
   "priority": 1,
   "conflict": "与其余因子竞争",
   "source": "S-001:425085"
  },
  {
   "id": "R-023-2",
   "when": "当自身原动力与利他行为冲突",
   "then": "选择自毁式解法",
   "priority": 2,
   "conflict": "—",
   "source": "S-001:425085"
  },
  {
   "id": "R-023-3",
   "when": "当被要求继承火种",
   "then": "按试炼规则接受或拒绝",
   "priority": 3,
   "conflict": "—",
   "source": "S-001:425085"
  }
 ],
 "speech": {
  "tone": "支配",
  "address": {
   "to_peer": "你",
   "to_enemy": "—",
   "to_self": "我"
  },
  "catchphrases": [],
  "taboo_topics": [],
  "sentence_style": "—"
 },
 "relations": [
  {
   "target": "CHR-008",
   "type": "trust",
   "intensity": 0.6,
   "source": "S-001:425085"
  }
 ],
 "behavior_patterns": [
  {
   "scene": "逐火",
   "action": "履行本路径职责",
   "reason": "—",
   "source": "S-001:425085"
  }
 ],
 "arc": [
  {
   "phase": "start",
   "state": "许珀耳君主、凯撒",
   "source": "S-001:73321"
  },
  {
   "phase": "turn",
   "state": "牺牲五百黄金裔取律法控制权",
   "source": "S-001:30416"
  },
  {
   "phase": "end",
   "state": "死于海瑟音剑下（幻梦）",
   "source": "S-001:30415"
  }
 ],
 "failure_modes": [
  "原动力与利他行为的矛盾导致自我消解"
 ],
 "ooc_guards": [
  "不得只写形容词，必须落到 decision_rule"
 ],
 "inference": [],
 "evidence": [
  "S-001:425085"
 ],
 "confidence": "A"
}